{
  "protocol_version": "qf-v3-protocol-0.1",
  "schema_name": "ArtifactEnvelope",
  "schema_version": "0.1.1",
  "artifact": {
    "artifact_id": "long_context_judgment_live_pilot_001_artifact",
    "artifact_type": "judgment_principle_proposal",
    "lab_id": "long_context_judgment",
    "method_id": "long_context_judgment_live_pilot_001_method",
    "run_id": "long_context_judgment_live_pilot_001_run",
    "source_refs": [
      "raw_corpora_sha256:d8392c58c3b740eb"
    ],
    "posture": {
      "grounding_status": "source_linked",
      "review_status": "self_checked",
      "readiness_status": "study_candidate",
      "validation_status": "none",
      "lifecycle_status": "active"
    },
    "blockers": [
      "proposal_only_not_evaluated",
      "method_quality_not_evaluated",
      "raw_output_local_only"
    ],
    "summary": "One admitted DeepSeek V4 Flash live pilot produced proposal-only parsed output metadata from an ignored local source excerpt. The committed record stores only hashes, counts, model/config metadata, and boundary notes.",
    "payload": {
      "outcome_polarity": "proposal_only",
      "proposal_only": true,
      "provider_id": "deepseek_api",
      "api_format": "openai_compatible_chat_completions",
      "base_url": "https://api.deepseek.com",
      "model_id": "deepseek-v4-flash",
      "requested_model_id": "deepseek-v4-flash",
      "thinking": {
        "type": "disabled"
      },
      "stream": false,
      "tool_routing": "none",
      "prompt_template_path": "labs/long_context_judgment/PLANNING/live_llm_pilot_001/prompt_template.live_pilot_001.md",
      "prompt_template_sha256": "b842070956374c17ddd6d966c069c28ad4ff22dd753b20370c72cb03df79dae6",
      "config_sha256": "390729eba63d8b3ae2364631bb98b4ab2b218683cd069ba1c84778d26f2cdfac",
      "source_metadata": {
        "source_ref": "raw_corpora_sha256:d8392c58c3b740eb",
        "source_scope": "operator-approved ignored local trader education transcript excerpt",
        "source_path_scope": "raw_corpora/trader_source_corpus/transcripts/how-to-use-market-profile-start-now-trading-tutorials.txt",
        "source_file_sha256": "dca704a5010abf9b56498a325702c895fd6ab2ae7815b26021b20f8f89dcdd95",
        "source_file_word_count": 8849,
        "excerpt_sha256": "d8392c58c3b740eb87efd9488fd72da35ef3d09f6a4ee766a9816f672d9b03ee",
        "excerpt_word_count": 650,
        "raw_source_text_committed": false
      },
      "token_metadata": {
        "prompt_tokens": 1166,
        "completion_tokens": 1070,
        "total_tokens": 2236
      },
      "cost_metadata": {
        "budget_cap_usd": 3.0,
        "estimated_cost_usd": 0.00046284,
        "estimated_cost_usd_upper_bound": 0.00046284,
        "pricing_basis": "DeepSeek V4 Flash public cache-miss input and output rates checked against official docs on 2026-06-07"
      },
      "model_output_metadata": {
        "raw_model_output_sha256": "2faaf2572732f301298d9b3ba3d38346f7a03959b7bdeec767756ad2815f61a8",
        "raw_response_sha256": "a1f7ea560dc54cb106b72a398ff2e4b01f2ca22b93b30687e0e47fbdda1a74a6",
        "parsed_json_success": true,
        "parsed_top_level_keys": [
          "judgment_principle_proposals",
          "method_failure_notes",
          "source_grounded_claims",
          "unsupported_claim_reports"
        ],
        "parsed_output_counts": {
          "judgment_principle_proposals": 2,
          "source_grounded_claims": 4,
          "unsupported_claim_reports": 2,
          "method_failure_notes": 2
        },
        "sanitized_output_summary": "The model returned two judgment-principle proposals, four source-grounded-claim records, two unsupported-claim reports, and two method-failure notes. The raw model output is stored only in ignored local trace storage."
      },
      "trace_storage_boundary": {
        "provider_request_trace": "provider_payloads/live_llm_pilot_001/request.json",
        "provider_response_trace": "provider_payloads/live_llm_pilot_001/response.json",
        "prompt_trace": "prompt_traces/live_llm_pilot_001/prompt.txt",
        "model_output_trace": "model_traces/live_llm_pilot_001/model_output.txt",
        "traces_committed": false
      },
      "raw_source_text_committed": false,
      "raw_provider_payload_committed": false,
      "raw_prompt_trace_committed": false,
      "raw_model_trace_committed": false,
      "secrets_committed": false,
      "failure_or_limitation_notes": [
        "This record captures a containment/protocol proof only.",
        "The model output was not evaluated for trading correctness, strategy value, product readiness, or source-truth authority.",
        "Full output text remains in ignored local trace storage and is not a committed authority surface."
      ],
      "boundary_disclaimer": "This is a proposal-only live LLM pilot record, not validation, product evidence, strategy evidence, financial advice, live-trading authority, or architecture."
    }
  }
}
